{
  "schema_version": "1.0",
  "artifact_kind": "pooleos_native_kernel_scheduler_readiness",
  "status_date": "2026-10-03",
  "status": "pass_single_host_two_run_qemu64_bsp_cooperative_scheduler_foundation_non_promoting",
  "contract_id": "PKSCHED1",
  "selected_move_id": "N12-SCHED-001",
  "production_ready": false,
  "production_promotion_allowed": false,
  "n12_exit_gate_satisfied": false,
  "phase_status": {
    "N12": "partial",
    "N12.1": "partial",
    "N12.2": "partial",
    "N12.5": "partial",
    "N12.6": "partial",
    "N12.7": "partial"
  },
  "inputs": {
    "implementation": [
      {
        "path": "runtime/native_kernel_profile_evidence.py",
        "byte_count": 6286,
        "sha256": "E40689F34D4ACA0318E2981AA81928969FA2BEAD786380F69088AD8260E765BE"
      },
      {
        "path": "tests/test_native_memory_entry_provenance.py",
        "byte_count": 4686,
        "sha256": "35E35598C58B141DDD2E895BD0CC39CD296DFC6CB2F0DDE2BFBE88AA47DA513A"
      },
      {
        "path": "runs/native_kernel_entry_readiness.json",
        "byte_count": 32134,
        "sha256": "080A019D50DBBA7CCA32FAD792D70949A4E0A21DC43E9F52031B371227B56E53"
      },
      {
        "path": "native/Cargo.lock",
        "byte_count": 4193,
        "sha256": "29CE9938C5C60DEA5AEA244A6961BB1924D88AEC601D1E02EAAA510B0B36E390"
      },
      {
        "path": "native/boot/Cargo.toml",
        "byte_count": 1863,
        "sha256": "C9175879FB21AAE932016F9E1E4F46DD0070BF0D6A2DB32AB370AF7C4D0687F6"
      },
      {
        "path": "native/boot/src/exit.rs",
        "byte_count": 44748,
        "sha256": "C12DC15E6688669A1FB8309CD40397F8191A6D3164BCBAB4BF450EED55F40529"
      },
      {
        "path": "native/bootexit/src/lib.rs",
        "byte_count": 18272,
        "sha256": "B38A280AA2390DB005DA05FE3BC60BB507A67A1A1A6608183D9DE294EC980ECF"
      },
      {
        "path": "native/kernel/Cargo.toml",
        "byte_count": 1371,
        "sha256": "F9F3AB6D84008B0354A5B82B0F616C5652C076C15F3313F14B862ED0DB1C1C43"
      },
      {
        "path": "native/kernel/manifest.pkm",
        "byte_count": 447,
        "sha256": "EF44B0C7C860CF885EC8C8412064975394157EBF7EFAFDBEAAA7F762F342A2D3"
      },
      {
        "path": "native/kernel/src/lib.rs",
        "byte_count": 65667,
        "sha256": "2D250350037711690B64B4F67041FBA7F9EAFA4E08794B33363D179FF0521720"
      },
      {
        "path": "native/kernel/src/main.rs",
        "byte_count": 538452,
        "sha256": "9A796DDEB435DF8CC87621F3B3E104FD06A2034408BE2F61FCE4900A5BA742B6"
      },
      {
        "path": "native/kernel/src/arch/x86_64.rs",
        "byte_count": 162769,
        "sha256": "F39BB4327F83BC44AE4E38DDFA0F46793209F30D7CA3B7A0A44342FC1BBDC058"
      },
      {
        "path": "native/kernel/src/scheduler.rs",
        "byte_count": 50523,
        "sha256": "699D2EB712489E95D35729F72438906C97EF336A04112EFF910BB46074CAE21B"
      },
      {
        "path": "native/kernel/src/bin/pksched1_probe.rs",
        "byte_count": 8589,
        "sha256": "40D13FF8025835A579B7986D95469F5415C5FD6088D1026BD620A1927399E747"
      },
      {
        "path": "models/tla/PooleScheduler.tla",
        "byte_count": 12628,
        "sha256": "4029DCBE7A9FD5A13FFC50D8B708B824216A1422B8355DA966D8ADE6CC098D67"
      },
      {
        "path": "models/tla/PooleScheduler.safe.cfg",
        "byte_count": 761,
        "sha256": "4D8DE4C5E78DF574E432A64D77825D566B8C45D495C8A541A2306141F97CFE33"
      },
      {
        "path": "runtime/native_kernel_scheduler.py",
        "byte_count": 29682,
        "sha256": "5FAE21F0C2A2F6B63CA458D349974A323795F85BB3579DC0170B288FB7052103"
      },
      {
        "path": "specs/native-kernel-scheduler-contract.json",
        "byte_count": 7799,
        "sha256": "70DFA34BC4CDE80630AF10D97940656C220F12F6D6CA4BA3561B14394EB6DF1F"
      },
      {
        "path": "specs/native-kernel-scheduler-contract.schema.json",
        "byte_count": 7072,
        "sha256": "E9E6C63042D790B51FFCC44D97CF4CCE8A2A045095E5CB31C7379D61C5CB96CC"
      },
      {
        "path": "specs/native-kernel-scheduler-readiness.schema.json",
        "byte_count": 4366,
        "sha256": "8181623D59DD76A953DCED57B408152104A888336C8C785474A9AFA4A62D03B3"
      },
      {
        "path": "tools/qualify_native_pooleboot.py",
        "byte_count": 42224,
        "sha256": "9377738EC9F76CE255D7D563ED98DE8D5053ED1D0C1644FE833E3A58F283A7B5"
      },
      {
        "path": "tools/qualify_native_kernel_scheduler.py",
        "byte_count": 40099,
        "sha256": "83FBF99766B373FFFDEBAE31030432B5C2105B091024962C22F654AA4FACD9CD"
      },
      {
        "path": "tests/test_native_kernel_scheduler.py",
        "byte_count": 15927,
        "sha256": "BA1FD65F5236E59A63C124F806D96938DBB75C13479260F60B333D2CAF8E80FC"
      },
      {
        "path": "docs/native-kernel-scheduler.md",
        "byte_count": 5577,
        "sha256": "A072AA29B7B2332D5617B05E77B2D03064AE629277E6A3ACF918B43B67F4F322"
      }
    ]
  },
  "build": {
    "kernel_entry": {
      "schema_version": "1.0",
      "artifact_kind": "pooleos_native_kernel_entry_readiness",
      "status_date": "2026-07-16",
      "status": "pass_single_host_product_image_non_promoting",
      "contract_id": "PKENTRY1",
      "selected_move_id": "N6-KENTRY-001",
      "production_ready": false,
      "production_promotion_allowed": false,
      "n6_exit_gate_satisfied": false,
      "phase_status": {
        "N6": "partial",
        "N6.4": "partial",
        "N6.5": "partial",
        "N6.6": "partial"
      },
      "bindings": {
        "contract": {
          "path": "specs/native-kernel-entry-contract.json",
          "byte_count": 10872,
          "sha256": "8A2371202166E06787A0193EF1C94E2F3F038B061048ACBCD9973E53C10A4FD6"
        },
        "contract_schema": {
          "path": "specs/native-kernel-entry-contract.schema.json",
          "byte_count": 3952,
          "sha256": "1F4E6E514F930AB092F8B7ADB2F914AF35F66F784337CB40611D28B2F9ACAF8A"
        },
        "readiness_schema": {
          "path": "specs/native-kernel-entry-readiness.schema.json",
          "byte_count": 1258,
          "sha256": "AAEB429160252FE060A3330D8056DE129FA608EA1E56A1DD0B0DDF8CED67ABF4"
        },
        "pbp1_contract": {
          "path": "specs/native-boot-handoff-contract.json",
          "byte_count": 16126,
          "sha256": "89EA7517EF7D2E30C7EBEC4C28D092E3F01D95519EC6768E7B4D5C0F586B58E7"
        },
        "pkelf1_contract": {
          "path": "specs/native-elf-loader-contract.json",
          "byte_count": 5797,
          "sha256": "A0CE48E9EF992B97333D84ECB2850E221D482E2ACF11BB312B5F769DAFF992AA"
        },
        "toolchain_lock": {
          "path": "specs/native-toolchain-lock.json",
          "byte_count": 4017,
          "sha256": "79084B39BC43C0B3B96ABE93328184338470A2FFFF257C6E2305215E6B2CCA4E"
        },
        "implementation_inputs": [
          {
            "path": "native/Cargo.toml",
            "byte_count": 601,
            "sha256": "210BCDAF2778606B42C688E7BACD950FC0EEF3045081E884CF7846B9A7D78DF4"
          },
          {
            "path": "native/Cargo.lock",
            "byte_count": 4193,
            "sha256": "29CE9938C5C60DEA5AEA244A6961BB1924D88AEC601D1E02EAAA510B0B36E390"
          },
          {
            "path": "native/kernel/Cargo.toml",
            "byte_count": 1371,
            "sha256": "F9F3AB6D84008B0354A5B82B0F616C5652C076C15F3313F14B862ED0DB1C1C43"
          },
          {
            "path": "native/kernel/README.md",
            "byte_count": 3199,
            "sha256": "804016CE88E41A3FAFF8130D6E6484AFCD2AC821625DC47CEA7EEDBD3524F41B"
          },
          {
            "path": "native/kernel/arch/x86_64/README.md",
            "byte_count": 1417,
            "sha256": "E7589BC85E7A56A67AFCFA335EB292D5262FBC37D78F4720AD4C3A76EBB205EB"
          },
          {
            "path": "native/kernel/linker.ld",
            "byte_count": 2048,
            "sha256": "891C725E24D882C2243BE0816B002D23857C2BE341F507B922B360204D9CFD87"
          },
          {
            "path": "native/kernel/manifest.pkm",
            "byte_count": 447,
            "sha256": "EF44B0C7C860CF885EC8C8412064975394157EBF7EFAFDBEAAA7F762F342A2D3"
          },
          {
            "path": "native/kernel/src/lib.rs",
            "byte_count": 65667,
            "sha256": "2D250350037711690B64B4F67041FBA7F9EAFA4E08794B33363D179FF0521720"
          },
          {
            "path": "native/kernel/src/main.rs",
            "byte_count": 538452,
            "sha256": "9A796DDEB435DF8CC87621F3B3E104FD06A2034408BE2F61FCE4900A5BA742B6"
          },
          {
            "path": "native/kernel/src/arch/x86_64.rs",
            "byte_count": 162769,
            "sha256": "F39BB4327F83BC44AE4E38DDFA0F46793209F30D7CA3B7A0A44342FC1BBDC058"
          },
          {
            "path": "native/kernel/src/scheduler.rs",
            "byte_count": 50523,
            "sha256": "699D2EB712489E95D35729F72438906C97EF336A04112EFF910BB46074CAE21B"
          },
          {
            "path": "native/kernel/src/scheduler_preempt.rs",
            "byte_count": 24328,
            "sha256": "DD93A83C27F49D78CBFBB1A5DB026DAC2206099E226E2038595B72DC7A81D0E4"
          },
          {
            "path": "native/kernel/src/acpi.rs",
            "byte_count": 33519,
            "sha256": "E018A4DED4146791A2F88374B49CADD7356C8187807EDFBDD6FEAAA4527EB58F"
          },
          {
            "path": "native/kernel/src/physical_memory.rs",
            "byte_count": 196651,
            "sha256": "ABFEF48FEE61D4BA7AC00E067901804795FEBBBB1611878E84D5C40892587F72"
          },
          {
            "path": "native/kernel/src/physical_memory/retention.rs",
            "byte_count": 9602,
            "sha256": "CEBC587CFCD784D747C202EF4935EDCFD5A1FEE6E97F28EDCB3AD8EA6CD61EB8"
          },
          {